===================================================
0
===================================================
makedate(1990, 0)    
null     

===================================================
makedate(1990, 5)    
1990-01-05     

===================================================
makedate('3600', '5')    
3600-01-05     

===================================================
makedate(1990.1, 5)    
1990-01-05     

===================================================
makedate(1990.5, 5)    
1991-01-05     

===================================================
makedate(1990.9, 5)    
1991-01-05     

===================================================
0
===================================================
2
===================================================
char_col    makedate(char_col, smallint_col)    
2010-01-02                           2010-01-10     
2010-01-02                           2010-01-11     

===================================================
varchar_col    makedate(varchar_col, smallint_col)    
6200     6200-01-10     
1971-12-22 00:14:11     1971-01-11     

===================================================
string_col    makedate(string_col, smallint_col)    
05/04/2010 12:23:15.123     2005-01-10     
10/04/2010 12:23:15.123     2010-01-11     

===================================================
bit_col    makedate(bit_col, smallint_col)    
null     null     
null     null     

===================================================
integer_col    makedate(integer_col, smallint_col)    
12000     null     
12000     null     

===================================================
smallint_col    makedate(smallint_col, smallint_col)    
10     2010-01-10     
11     2011-01-11     

===================================================
bigint_col    makedate(bigint_col, smallint_col)    
1111111111     null     
1111111111     null     

===================================================
float_col    makedate(float_col, smallint_col)    
12.25     2012-01-10     
12.25     2012-01-11     

===================================================
double_col    makedate(double_col, smallint_col)    
111.11111111     0111-01-10     
111.11111111     0111-01-11     

===================================================
numeric_col    makedate(numeric_col, smallint_col)    
11.12     2011-01-10     
11.12     2011-01-11     

===================================================
monetary_col    makedate(monetary_col, smallint_col)    
1234.0     2000-01-10     
1234.0     2000-01-11     

===================================================
date_col    makedate(date_col, smallint_col)    
2010-01-02 00:00:00.0     2012-01-10     
2010-01-02 00:00:00.0     2012-01-11     

===================================================
time_col    makedate(time_col, smallint_col)    
12:10:09     2012-01-10     
12:10:09     2012-01-11     

===================================================
timestamp_col    makedate(timestamp_col, smallint_col)    
2008-10-11 10:49:51.0     2010-01-10     
2008-10-11 10:49:51.0     2010-01-11     

===================================================
datetime_col    makedate(datetime_col, smallint_col)    
1983-01-02 17:28:31.0     2005-01-10     
1983-01-02 17:28:31.0     2005-01-11     

===================================================
Error:-494
===================================================
char_col    varchar_col    string_col    bit_col    integer_col    smallint_col    bigint_col    float_col    double_col    numeric_col    monetary_col    date_col    time_col    timestamp_col    datetime_col    set_col    

===================================================
0
===================================================
0
===================================================
attr_name    class_name    attr_type    def_order    from_class_name    from_attr_name    data_type    prec    scale    charset    collation    domain_class_name    default_value    is_nullable    comment    
 makedate('2010', 123)     makedate_tests     INSTANCE     0     null     null     DATE     10     0     Not applicable     Not applicable     null     null     YES     null     

===================================================
makedate('2010', 123)    
2010-05-03     

===================================================
0
===================================================
0
===================================================
v    
2010-01-05     

===================================================
0
===================================================
Error:-494
===================================================
rez    
2540-01-12     

===================================================
rez    
2540-01-10     

===================================================
rez    
3540-01-10     

===================================================
rez    
2016-12-15     

===================================================
Error:-494
===================================================
rez    
2540-01-12     

===================================================
rez    
1906-12-15     

===================================================
rez    
1     

===================================================
makedate(2000, 1)    if( makedate(2000, 1)='2000-01-01', 'ok', 'nok')    
2000-01-01     ok     

===================================================
makedate(2000, 31+1)    if( makedate(2000, 31+1)='2000-02-01', 'ok', 'nok')    
2000-02-01     ok     

===================================================
makedate(2000, 31+29+1)    if( makedate(2000, 31+29+1)='2000-03-01', 'ok', 'nok')    
2000-03-01     ok     

===================================================
makedate(2000, 31+29+31+1)    if( makedate(2000, 31+29+31+1)='2000-04-01', 'ok', 'nok')    
2000-04-01     ok     

===================================================
makedate(2000, 31+29+31+30+1)    if( makedate(2000, 31+29+31+30+1)='2000-05-01', 'ok', 'nok')    
2000-05-01     ok     

===================================================
makedate(2000, 31+29+31+30+31+1)    if( makedate(2000, 31+29+31+30+31+1)='2000-06-01', 'ok', 'nok')    
2000-06-01     ok     

===================================================
makedate(2000, 31+29+31+30+31+30+1)    if( makedate(2000, 31+29+31+30+31+30+1)='2000-07-01', 'ok', 'nok')    
2000-07-01     ok     

===================================================
makedate(2000, 31+29+31+30+31+30+31+1)    if( makedate(2000, 31+29+31+30+31+30+31+1)='2000-08-01', 'ok', 'nok')    
2000-08-01     ok     

===================================================
makedate(2000, 31+29+31+30+31+30+31+31+1)    if( makedate(2000, 31+29+31+30+31+30+31+31+1)='2000-09-01', 'ok', 'nok')    
2000-09-01     ok     

===================================================
makedate(2000, 31+29+31+30+31+30+31+31+30+1)    if( makedate(2000, 31+29+31+30+31+30+31+31+30+1)='2000-10-01', 'ok', 'nok')    
2000-10-01     ok     

===================================================
makedate(2000, 31+29+31+30+31+30+31+31+30+31+1)    if( makedate(2000, 31+29+31+30+31+30+31+31+30+31+1)='2000-11-01', 'ok', 'nok')    
2000-11-01     ok     

===================================================
makedate(2000, 31+29+31+30+31+30+31+31+30+31+30+1)    if( makedate(2000, 31+29+31+30+31+30+31+31+30+31+30+1)='2000-12-01', 'ok', 'nok')    
2000-12-01     ok     

===================================================
makedate(2000, 31+29+31+30+31+30+31+31+30+31+30+31)    if( makedate(2000, 31+29+31+30+31+30+31+31+30+31+30+31)='2000-12-31', 'ok', 'nok')    
2000-12-31     ok     

===================================================
makedate(1980, date '05/08/1980'-date '01/01/1980'+1)    if( makedate(1980, date '05/08/1980'-date '01/01/1980'+1)=date '05/08/1980', 'ok', 'nok')    
1980-05-08     ok     

===================================================
makedate(1980, date '09/18/1980'-date '01/01/1980'+1)    if( makedate(1980, date '09/18/1980'-date '01/01/1980'+1)=date '09/18/1980', 'ok', 'nok')    
1980-09-18     ok     

===================================================
makedate(1980, date '11/23/1980'-date '01/01/1980'+1)    if( makedate(1980, date '11/23/1980'-date '01/01/1980'+1)=date '11/23/1980', 'ok', 'nok')    
1980-11-23     ok     

===================================================
makedate(1980, date '07/30/1980'-date '01/01/1980'+1)    if( makedate(1980, date '07/30/1980'-date '01/01/1980'+1)=date '07/30/1980', 'ok', 'nok')    
1980-07-30     ok     

===================================================
makedate(1980, date '08/20/1980'-date '01/01/1980'+1)    if( makedate(1980, date '08/20/1980'-date '01/01/1980'+1)=date '08/20/1980', 'ok', 'nok')    
1980-08-20     ok     

===================================================
makedate(1977, date '05/08/1977'-date '01/01/1977'+1)    if( makedate(1977, date '05/08/1977'-date '01/01/1977'+1)=date '05/08/1977', 'ok', 'nok')    
1977-05-08     ok     

===================================================
makedate(1977, date '09/18/1977'-date '01/01/1977'+1)    if( makedate(1977, date '09/18/1977'-date '01/01/1977'+1)=date '09/18/1977', 'ok', 'nok')    
1977-09-18     ok     

===================================================
makedate(1977, date '11/23/1977'-date '01/01/1977'+1)    if( makedate(1977, date '11/23/1977'-date '01/01/1977'+1)=date '11/23/1977', 'ok', 'nok')    
1977-11-23     ok     

===================================================
makedate(1977, date '07/30/1977'-date '01/01/1977'+1)    if( makedate(1977, date '07/30/1977'-date '01/01/1977'+1)=date '07/30/1977', 'ok', 'nok')    
1977-07-30     ok     

===================================================
makedate(1977, date '08/20/1977'-date '01/01/1977'+1)    if( makedate(1977, date '08/20/1977'-date '01/01/1977'+1)=date '08/20/1977', 'ok', 'nok')    
1977-08-20     ok     

===================================================
makedate(2003, date '05/08/2003'-date '01/01/2003'+1)    if( makedate(2003, date '05/08/2003'-date '01/01/2003'+1)=date '05/08/2003', 'ok', 'nok')    
2003-05-08     ok     

===================================================
makedate(2003, date '09/18/2003'-date '01/01/2003'+1)    if( makedate(2003, date '09/18/2003'-date '01/01/2003'+1)=date '09/18/2003', 'ok', 'nok')    
2003-09-18     ok     

===================================================
makedate(2003, date '11/23/2003'-date '01/01/2003'+1)    if( makedate(2003, date '11/23/2003'-date '01/01/2003'+1)=date '11/23/2003', 'ok', 'nok')    
2003-11-23     ok     

===================================================
makedate(2003, date '07/30/2003'-date '01/01/2003'+1)    if( makedate(2003, date '07/30/2003'-date '01/01/2003'+1)=date '07/30/2003', 'ok', 'nok')    
2003-07-30     ok     

===================================================
makedate(2003, date '08/20/2003'-date '01/01/2003'+1)    if( makedate(2003, date '08/20/2003'-date '01/01/2003'+1)=date '08/20/2003', 'ok', 'nok')    
2003-08-20     ok     

===================================================
makedate(2000, 0)    
null     

===================================================
makedate(2000, -1)    
null     

===================================================
makedate(10000, 1)    
null     

===================================================
makedate(-1, 1)    
null     

===================================================
0
===================================================
Error:-494
===================================================
makedate(1990, 5)    
1990-01-05     

===================================================
makedate('3600', '5')    
3600-01-05     

===================================================
makedate(1990.1, 5)    
1990-01-05     

===================================================
makedate(1990.5, 5)    
1991-01-05     

===================================================
makedate(1990.9, 5)    
1991-01-05     

===================================================
0
===================================================
2
===================================================
char_col    makedate(char_col, smallint_col)    
2010-01-02                           2010-01-10     
2010-01-02                           2010-01-11     

===================================================
varchar_col    makedate(varchar_col, smallint_col)    
6200     6200-01-10     
1971-12-22 00:14:11     1971-01-11     

===================================================
string_col    makedate(string_col, smallint_col)    
05/04/2010 12:23:15.123     2005-01-10     
10/04/2010 12:23:15.123     2010-01-11     

===================================================
bit_col    makedate(bit_col, smallint_col)    
null     null     
null     null     

===================================================
Error:-176
===================================================
smallint_col    makedate(smallint_col, smallint_col)    
10     2010-01-10     
11     2011-01-11     

===================================================
Error:-176
===================================================
float_col    makedate(float_col, smallint_col)    
12.25     2012-01-10     
12.25     2012-01-11     

===================================================
double_col    makedate(double_col, smallint_col)    
111.11111111     0111-01-10     
111.11111111     0111-01-11     

===================================================
numeric_col    makedate(numeric_col, smallint_col)    
11.12     2011-01-10     
11.12     2011-01-11     

===================================================
monetary_col    makedate(monetary_col, smallint_col)    
1234.0     2000-01-10     
1234.0     2000-01-11     

===================================================
date_col    makedate(date_col, smallint_col)    
2010-01-02 00:00:00.0     2012-01-10     
2010-01-02 00:00:00.0     2012-01-11     

===================================================
time_col    makedate(time_col, smallint_col)    
12:10:09     2012-01-10     
12:10:09     2012-01-11     

===================================================
timestamp_col    makedate(timestamp_col, smallint_col)    
2008-10-11 10:49:51.0     2010-01-10     
2008-10-11 10:49:51.0     2010-01-11     

===================================================
datetime_col    makedate(datetime_col, smallint_col)    
1983-01-02 17:28:31.0     2005-01-10     
1983-01-02 17:28:31.0     2005-01-11     

===================================================
Error:-494
===================================================
Error:-494
===================================================
0
===================================================
0
===================================================
attr_name    class_name    attr_type    def_order    from_class_name    from_attr_name    data_type    prec    scale    charset    collation    domain_class_name    default_value    is_nullable    comment    
 makedate('2010', 123)     makedate_tests     INSTANCE     0     null     null     DATE     10     0     Not applicable     Not applicable     null     null     YES     null     

===================================================
makedate('2010', 123)    
2010-05-03     

===================================================
0
===================================================
0
===================================================
v    
2010-01-05     

===================================================
0
===================================================
Error:-494
===================================================
rez    
2540-01-12     

===================================================
rez    
2540-01-10     

===================================================
rez    
3540-01-10     

===================================================
rez    
2016-12-15     

===================================================
Error:-494
===================================================
rez    
2540-01-12     

===================================================
rez    
1906-12-15     

===================================================
rez    
1     

===================================================
makedate(2000, 1)    if( makedate(2000, 1)='2000-01-01', 'ok', 'nok')    
2000-01-01     ok     

===================================================
makedate(2000, 31+1)    if( makedate(2000, 31+1)='2000-02-01', 'ok', 'nok')    
2000-02-01     ok     

===================================================
makedate(2000, 31+29+1)    if( makedate(2000, 31+29+1)='2000-03-01', 'ok', 'nok')    
2000-03-01     ok     

===================================================
makedate(2000, 31+29+31+1)    if( makedate(2000, 31+29+31+1)='2000-04-01', 'ok', 'nok')    
2000-04-01     ok     

===================================================
makedate(2000, 31+29+31+30+1)    if( makedate(2000, 31+29+31+30+1)='2000-05-01', 'ok', 'nok')    
2000-05-01     ok     

===================================================
makedate(2000, 31+29+31+30+31+1)    if( makedate(2000, 31+29+31+30+31+1)='2000-06-01', 'ok', 'nok')    
2000-06-01     ok     

===================================================
makedate(2000, 31+29+31+30+31+30+1)    if( makedate(2000, 31+29+31+30+31+30+1)='2000-07-01', 'ok', 'nok')    
2000-07-01     ok     

===================================================
makedate(2000, 31+29+31+30+31+30+31+1)    if( makedate(2000, 31+29+31+30+31+30+31+1)='2000-08-01', 'ok', 'nok')    
2000-08-01     ok     

===================================================
makedate(2000, 31+29+31+30+31+30+31+31+1)    if( makedate(2000, 31+29+31+30+31+30+31+31+1)='2000-09-01', 'ok', 'nok')    
2000-09-01     ok     

===================================================
makedate(2000, 31+29+31+30+31+30+31+31+30+1)    if( makedate(2000, 31+29+31+30+31+30+31+31+30+1)='2000-10-01', 'ok', 'nok')    
2000-10-01     ok     

===================================================
makedate(2000, 31+29+31+30+31+30+31+31+30+31+1)    if( makedate(2000, 31+29+31+30+31+30+31+31+30+31+1)='2000-11-01', 'ok', 'nok')    
2000-11-01     ok     

===================================================
makedate(2000, 31+29+31+30+31+30+31+31+30+31+30+1)    if( makedate(2000, 31+29+31+30+31+30+31+31+30+31+30+1)='2000-12-01', 'ok', 'nok')    
2000-12-01     ok     

===================================================
makedate(2000, 31+29+31+30+31+30+31+31+30+31+30+31)    if( makedate(2000, 31+29+31+30+31+30+31+31+30+31+30+31)='2000-12-31', 'ok', 'nok')    
2000-12-31     ok     

===================================================
makedate(1980, date '05/08/1980'-date '01/01/1980'+1)    if( makedate(1980, date '05/08/1980'-date '01/01/1980'+1)=date '05/08/1980', 'ok', 'nok')    
1980-05-08     ok     

===================================================
makedate(1980, date '09/18/1980'-date '01/01/1980'+1)    if( makedate(1980, date '09/18/1980'-date '01/01/1980'+1)=date '09/18/1980', 'ok', 'nok')    
1980-09-18     ok     

===================================================
makedate(1980, date '11/23/1980'-date '01/01/1980'+1)    if( makedate(1980, date '11/23/1980'-date '01/01/1980'+1)=date '11/23/1980', 'ok', 'nok')    
1980-11-23     ok     

===================================================
makedate(1980, date '07/30/1980'-date '01/01/1980'+1)    if( makedate(1980, date '07/30/1980'-date '01/01/1980'+1)=date '07/30/1980', 'ok', 'nok')    
1980-07-30     ok     

===================================================
makedate(1980, date '08/20/1980'-date '01/01/1980'+1)    if( makedate(1980, date '08/20/1980'-date '01/01/1980'+1)=date '08/20/1980', 'ok', 'nok')    
1980-08-20     ok     

===================================================
makedate(1977, date '05/08/1977'-date '01/01/1977'+1)    if( makedate(1977, date '05/08/1977'-date '01/01/1977'+1)=date '05/08/1977', 'ok', 'nok')    
1977-05-08     ok     

===================================================
makedate(1977, date '09/18/1977'-date '01/01/1977'+1)    if( makedate(1977, date '09/18/1977'-date '01/01/1977'+1)=date '09/18/1977', 'ok', 'nok')    
1977-09-18     ok     

===================================================
makedate(1977, date '11/23/1977'-date '01/01/1977'+1)    if( makedate(1977, date '11/23/1977'-date '01/01/1977'+1)=date '11/23/1977', 'ok', 'nok')    
1977-11-23     ok     

===================================================
makedate(1977, date '07/30/1977'-date '01/01/1977'+1)    if( makedate(1977, date '07/30/1977'-date '01/01/1977'+1)=date '07/30/1977', 'ok', 'nok')    
1977-07-30     ok     

===================================================
makedate(1977, date '08/20/1977'-date '01/01/1977'+1)    if( makedate(1977, date '08/20/1977'-date '01/01/1977'+1)=date '08/20/1977', 'ok', 'nok')    
1977-08-20     ok     

===================================================
makedate(2003, date '05/08/2003'-date '01/01/2003'+1)    if( makedate(2003, date '05/08/2003'-date '01/01/2003'+1)=date '05/08/2003', 'ok', 'nok')    
2003-05-08     ok     

===================================================
makedate(2003, date '09/18/2003'-date '01/01/2003'+1)    if( makedate(2003, date '09/18/2003'-date '01/01/2003'+1)=date '09/18/2003', 'ok', 'nok')    
2003-09-18     ok     

===================================================
makedate(2003, date '11/23/2003'-date '01/01/2003'+1)    if( makedate(2003, date '11/23/2003'-date '01/01/2003'+1)=date '11/23/2003', 'ok', 'nok')    
2003-11-23     ok     

===================================================
makedate(2003, date '07/30/2003'-date '01/01/2003'+1)    if( makedate(2003, date '07/30/2003'-date '01/01/2003'+1)=date '07/30/2003', 'ok', 'nok')    
2003-07-30     ok     

===================================================
makedate(2003, date '08/20/2003'-date '01/01/2003'+1)    if( makedate(2003, date '08/20/2003'-date '01/01/2003'+1)=date '08/20/2003', 'ok', 'nok')    
2003-08-20     ok     

===================================================
Error:-494
===================================================
Error:-494
===================================================
Error:-494
===================================================
Error:-494
===================================================
0
